### ISSUE TITLE
/32 routes are not offloaded

### ISSUE THREAD

**Issue by aep** [Marvell-switching/Switchdev-prestera#3]
Hi, thanks for the wiki!

https://github.com/Marvell-switching/Switchdev-prestera/wiki/static-route#static-route-limitations

does not mention an exception for /32 routes, yet they are not routed through the asic

test setup has a transfer net on swp1 and a single route to a downstream device on swp1

    192.168.10.41/32 dev swp2 scope link offload
    192.168.200.0/30 dev swp1 proto kernel scope link src 192.168.200.2 offload 

both say "offload" but the route from 200.1 back to 10.41 goes through cpu instead.

potentially related to ip neigh output lacking the offload tag:

    192.168.10.41 dev swp2 lladdr 80:61:5f:0a:46:83 REACHABLE
    192.168.200.1 dev swp1 lladdr 80:61:5f:07:42:09 offload REACHABLE

increasing the netmask from 32 to 31 makes it work, but that wastes an entire address per downstream port.

an alternative would be to use L2 bridging, but the tc flower driver doesnt support arp filtering to prevent a downstream from just responding to an arp request for a different IP on the same bridge.

**Comment by taraschornyiplv** [comment]
Can you please provide full steps starting from IP configuration on interfaces and adding routes.

**Comment by aep** [comment]
of course. on a fresh onl/dentos:

    ip addr add 192.168.200.2/30 dev swp1
    ip link set dev swp1 up
    
    ip addr add 192.168.10.1/32 dev swp2
    ip link set swp2 up
    ip route add 192.168.10.41/32 dev swp2

on a computer attached to swp1

    sudo ifconfig eth0 192.168.200.1/24
    sudo ip route add 192.168.10.0/24 via 192.168.200.2  

on a computer attached to swp2

    sudo ifconfig eth0 192.168.10.41/24
    sudo ip route add 192.168.200.0/24  via 192.168.10.1

    ping 192.168.200.2 (works)
    ping 192.168.200.1 (does not work)


observe the ping request is correctly routed on the computer attached to swp1 (through the /30 route):

    tcpdump -i eth0
    08:29:20.557369 IP 192.168.10.41 > 192.168.200.1: ICMP echo request, id 7, seq 154, length 64
    08:29:20.557406 IP 192.168.200.1 > 192.168.10.41: ICMP echo reply, id 7, seq 154, length 64

but back on the switch:

    tcpdump -i swp1
    14:21:25.747656 IP 192.168.200.1 > 192.168.10.41: ICMP echo reply, id 7, seq 70, length 64

observe the reply to 192.168.10.41  is dropped to cpu instead of being routed through the  /32 route
enabling ip_forward in the kernel makes it work, but that's through the cpu which is slow

**Comment by taraschornyiplv** [comment]
this issue is fixed in driver v3.1.1
